Walk-Forward ARIMA Statsmodels Forecasting for CRE.csv Column '1'
============================================================
Loaded 626 data points from column '1'
Data range: -0.071438 to 0.372102

ARIMA statsmodels model ready!

Starting walk-forward forecasting...
Using AR(10) for forecasting
Step 30: Synthetic history length 31, Actual: 0.142711, Forecast: 0.142711, Error: 0.000000
Using AR(10) for forecasting
Step 31: Synthetic history length 32, Actual: 0.143196, Forecast: 0.143196, Error: 0.000000
Using AR(10) for forecasting
Step 32: Synthetic history length 33, Actual: 0.143662, Forecast: 0.143662, Error: 0.000000
Using AR(10) for forecasting
Step 33: Synthetic history length 34, Actual: 0.144109, Forecast: 0.144109, Error: 0.000000
Using AR(10) for forecasting
Step 34: Synthetic history length 35, Actual: 0.144539, Forecast: 0.144539, Error: 0.000000
Using AR(10) for forecasting
Step 35: Synthetic history length 36, Actual: 0.144951, Forecast: 0.144952, Error: 0.000001
Using AR(10) for forecasting
Step 36: Synthetic history length 37, Actual: 0.145346, Forecast: 0.145348, Error: 0.000001
Using AR(10) for forecasting
Step 37: Synthetic history length 38, Actual: 0.145725, Forecast: 0.145727, Error: 0.000002
Using AR(10) for forecasting
Step 38: Synthetic history length 39, Actual: 0.146087, Forecast: 0.146090, Error: 0.000003
Using AR(10) for forecasting
Step 39: Synthetic history length 40, Actual: 0.146434, Forecast: 0.146438, Error: 0.000004
Using AR(10) for forecasting
Step 40: Synthetic history length 41, Actual: 0.146766, Forecast: 0.146770, Error: 0.000004
Using AR(10) for forecasting
Step 41: Synthetic history length 42, Actual: 0.147083, Forecast: 0.147087, Error: 0.000005
Using AR(10) for forecasting
Step 42: Synthetic history length 43, Actual: 0.147385, Forecast: 0.147390, Error: 0.000005
Using AR(10) for forecasting
Step 43: Synthetic history length 44, Actual: 0.147674, Forecast: 0.147678, Error: 0.000004
Using AR(10) for forecasting
Step 44: Synthetic history length 45, Actual: 0.147950, Forecast: 0.147952, Error: 0.000002
Using AR(10) for forecasting
Step 45: Synthetic history length 46, Actual: 0.148213, Forecast: 0.148211, Error: 0.000002
Using AR(10) for forecasting
Step 46: Synthetic history length 47, Actual: 0.148463, Forecast: 0.148456, Error: 0.000007
Using AR(10) for forecasting
Step 47: Synthetic history length 48, Actual: 0.148702, Forecast: 0.148686, Error: 0.000016
Using AR(10) for forecasting
Step 48: Synthetic history length 49, Actual: 0.148930, Forecast: 0.148902, Error: 0.000029
Using AR(10) for forecasting
Step 49: Synthetic history length 50, Actual: 0.149147, Forecast: 0.149102, Error: 0.000045
Using AR(10) for forecasting
Step 50: Synthetic history length 51, Actual: 0.149354, Forecast: 0.149287, Error: 0.000068
Using AR(10) for forecasting
Step 51: Synthetic history length 52, Actual: 0.149552, Forecast: 0.149456, Error: 0.000097
Using AR(10) for forecasting
Step 52: Synthetic history length 53, Actual: 0.149741, Forecast: 0.149608, Error: 0.000133
Using AR(10) for forecasting
Step 53: Synthetic history length 54, Actual: 0.149922, Forecast: 0.149743, Error: 0.000179
Using AR(10) for forecasting
Step 54: Synthetic history length 55, Actual: 0.150096, Forecast: 0.149861, Error: 0.000235
Using AR(10) for forecasting
Step 55: Synthetic history length 56, Actual: 0.150264, Forecast: 0.149961, Error: 0.000303
Using AR(10) for forecasting
Step 56: Synthetic history length 57, Actual: 0.150426, Forecast: 0.150041, Error: 0.000385
Using AR(10) for forecasting
Step 57: Synthetic history length 58, Actual: 0.150583, Forecast: 0.150101, Error: 0.000482
Using AR(10) for forecasting
Step 58: Synthetic history length 59, Actual: 0.150736, Forecast: 0.150141, Error: 0.000596
Using AR(10) for forecasting
Step 59: Synthetic history length 60, Actual: 0.150887, Forecast: 0.150158, Error: 0.000729
Using AR(10) for forecasting
Step 60: Synthetic history length 61, Actual: 0.151036, Forecast: 0.150154, Error: 0.000883
Using AR(10) for forecasting
Step 61: Synthetic history length 62, Actual: 0.151185, Forecast: 0.150126, Error: 0.001059
Using AR(10) for forecasting
Step 62: Synthetic history length 63, Actual: 0.151334, Forecast: 0.150073, Error: 0.001260
Using AR(10) for forecasting
Step 63: Synthetic history length 64, Actual: 0.151484, Forecast: 0.149996, Error: 0.001488
Using AR(10) for forecasting
Step 64: Synthetic history length 65, Actual: 0.151637, Forecast: 0.149893, Error: 0.001744
Using AR(10) for forecasting
Step 65: Synthetic history length 66, Actual: 0.151794, Forecast: 0.149764, Error: 0.002030
Using AR(10) for forecasting
Step 66: Synthetic history length 67, Actual: 0.151957, Forecast: 0.149608, Error: 0.002349
Using AR(10) for forecasting
Step 67: Synthetic history length 68, Actual: 0.152125, Forecast: 0.149424, Error: 0.002701
Using AR(10) for forecasting
Step 68: Synthetic history length 69, Actual: 0.152301, Forecast: 0.149212, Error: 0.003089
Using AR(10) for forecasting
Step 69: Synthetic history length 70, Actual: 0.152486, Forecast: 0.148972, Error: 0.003514
Using AR(10) for forecasting
Step 70: Synthetic history length 71, Actual: 0.152680, Forecast: 0.148703, Error: 0.003977
Using AR(10) for forecasting
Step 71: Synthetic history length 72, Actual: 0.152886, Forecast: 0.148406, Error: 0.004480
Using AR(10) for forecasting
Step 72: Synthetic history length 73, Actual: 0.153104, Forecast: 0.148080, Error: 0.005024
Using AR(10) for forecasting
Step 73: Synthetic history length 74, Actual: 0.153336, Forecast: 0.147725, Error: 0.005611
Using AR(10) for forecasting
Step 74: Synthetic history length 75, Actual: 0.153583, Forecast: 0.147342, Error: 0.006241
Using AR(10) for forecasting
Step 75: Synthetic history length 76, Actual: 0.153846, Forecast: 0.146931, Error: 0.006915
Using AR(10) for forecasting
Step 76: Synthetic history length 77, Actual: 0.154127, Forecast: 0.146493, Error: 0.007634
Using AR(10) for forecasting
Step 77: Synthetic history length 78, Actual: 0.154426, Forecast: 0.146028, Error: 0.008399
Using AR(10) for forecasting
Step 78: Synthetic history length 79, Actual: 0.154747, Forecast: 0.145536, Error: 0.009210
Using AR(10) for forecasting
Step 79: Synthetic history length 80, Actual: 0.155088, Forecast: 0.145020, Error: 0.010068
Using AR(10) for forecasting
Step 80: Synthetic history length 81, Actual: 0.155453, Forecast: 0.144480, Error: 0.010973
Using AR(10) for forecasting
Step 81: Synthetic history length 82, Actual: 0.155842, Forecast: 0.143917, Error: 0.011925
Using AR(10) for forecasting
Step 82: Synthetic history length 83, Actual: 0.156256, Forecast: 0.143331, Error: 0.012925
Using AR(10) for forecasting
Step 83: Synthetic history length 84, Actual: 0.156695, Forecast: 0.142725, Error: 0.013970
Using AR(10) for forecasting
Step 84: Synthetic history length 85, Actual: 0.157161, Forecast: 0.142100, Error: 0.015061
Using AR(10) for forecasting
Step 85: Synthetic history length 86, Actual: 0.157653, Forecast: 0.141456, Error: 0.016197
Using AR(10) for forecasting
Step 86: Synthetic history length 87, Actual: 0.158171, Forecast: 0.140796, Error: 0.017375
Using AR(10) for forecasting
Step 87: Synthetic history length 88, Actual: 0.158715, Forecast: 0.140120, Error: 0.018595
Using AR(10) for forecasting
Step 88: Synthetic history length 89, Actual: 0.159284, Forecast: 0.139430, Error: 0.019855
Using AR(10) for forecasting
Step 89: Synthetic history length 90, Actual: 0.159879, Forecast: 0.138726, Error: 0.021152
Using AR(10) for forecasting
Step 90: Synthetic history length 91, Actual: 0.160497, Forecast: 0.138012, Error: 0.022485
Using AR(10) for forecasting
Step 91: Synthetic history length 92, Actual: 0.161137, Forecast: 0.137286, Error: 0.023851
Using AR(10) for forecasting
Step 92: Synthetic history length 93, Actual: 0.161798, Forecast: 0.136551, Error: 0.025247
Using AR(10) for forecasting
Step 93: Synthetic history length 94, Actual: 0.162478, Forecast: 0.135807, Error: 0.026671
Using AR(10) for forecasting
Step 94: Synthetic history length 95, Actual: 0.163175, Forecast: 0.135055, Error: 0.028120
Using AR(10) for forecasting
Step 95: Synthetic history length 96, Actual: 0.163885, Forecast: 0.134296, Error: 0.029589
Using AR(10) for forecasting
Step 96: Synthetic history length 97, Actual: 0.164607, Forecast: 0.133529, Error: 0.031077
Using AR(10) for forecasting
Step 97: Synthetic history length 98, Actual: 0.165338, Forecast: 0.132757, Error: 0.032581
Using AR(10) for forecasting
Step 98: Synthetic history length 99, Actual: 0.166075, Forecast: 0.131977, Error: 0.034097
Using AR(10) for forecasting
Step 99: Synthetic history length 100, Actual: 0.166815, Forecast: 0.131192, Error: 0.035624
Using AR(10) for forecasting
Step 100: Synthetic history length 101, Actual: 0.167557, Forecast: 0.130399, Error: 0.037158
Using AR(10) for forecasting
Step 101: Synthetic history length 101, Actual: 0.168296, Forecast: 0.129599, Error: 0.038697
Using AR(10) for forecasting
Step 102: Synthetic history length 101, Actual: 0.169031, Forecast: 0.128792, Error: 0.040239
Using AR(10) for forecasting
Step 103: Synthetic history length 101, Actual: 0.169758, Forecast: 0.127976, Error: 0.041783
Using AR(10) for forecasting
Step 104: Synthetic history length 101, Actual: 0.170476, Forecast: 0.127150, Error: 0.043326
Using AR(10) for forecasting
Step 105: Synthetic history length 101, Actual: 0.171180, Forecast: 0.126313, Error: 0.044867
Using AR(10) for forecasting
Step 106: Synthetic history length 101, Actual: 0.171869, Forecast: 0.125465, Error: 0.046404
Using AR(10) for forecasting
Step 107: Synthetic history length 101, Actual: 0.172538, Forecast: 0.124602, Error: 0.047936
Using AR(10) for forecasting
Step 108: Synthetic history length 101, Actual: 0.173186, Forecast: 0.123725, Error: 0.049461
Using AR(10) for forecasting
Step 109: Synthetic history length 101, Actual: 0.173809, Forecast: 0.122832, Error: 0.050977
Using AR(10) for forecasting
Step 110: Synthetic history length 101, Actual: 0.174403, Forecast: 0.121920, Error: 0.052484
Using AR(10) for forecasting
Step 111: Synthetic history length 101, Actual: 0.174967, Forecast: 0.120988, Error: 0.053979
Using AR(10) for forecasting
Step 112: Synthetic history length 101, Actual: 0.175496, Forecast: 0.120034, Error: 0.055462
Using AR(10) for forecasting
Step 113: Synthetic history length 101, Actual: 0.175990, Forecast: 0.119057, Error: 0.056933
Using AR(10) for forecasting
Step 114: Synthetic history length 101, Actual: 0.176446, Forecast: 0.118054, Error: 0.058392
Using AR(10) for forecasting
Step 115: Synthetic history length 101, Actual: 0.176863, Forecast: 0.117024, Error: 0.059839
Using AR(10) for forecasting
Step 116: Synthetic history length 101, Actual: 0.177242, Forecast: 0.115966, Error: 0.061275
Using AR(10) for forecasting
Step 117: Synthetic history length 101, Actual: 0.177581, Forecast: 0.114879, Error: 0.062702
Using AR(10) for forecasting
Step 118: Synthetic history length 101, Actual: 0.177880, Forecast: 0.113760, Error: 0.064121
Using AR(10) for forecasting
Step 119: Synthetic history length 101, Actual: 0.178141, Forecast: 0.112608, Error: 0.065533
Using AR(10) for forecasting
Step 120: Synthetic history length 101, Actual: 0.178363, Forecast: 0.111424, Error: 0.066939
Using AR(10) for forecasting
Step 121: Synthetic history length 101, Actual: 0.178547, Forecast: 0.110205, Error: 0.068342
Using AR(10) for forecasting
Step 122: Synthetic history length 101, Actual: 0.178696, Forecast: 0.108953, Error: 0.069743
Using AR(10) for forecasting
Step 123: Synthetic history length 101, Actual: 0.178810, Forecast: 0.107666, Error: 0.071144
Using AR(10) for forecasting
Step 124: Synthetic history length 101, Actual: 0.178893, Forecast: 0.106344, Error: 0.072548
Using AR(10) for forecasting
Step 125: Synthetic history length 101, Actual: 0.178948, Forecast: 0.104989, Error: 0.073959
Using AR(10) for forecasting
Step 126: Synthetic history length 101, Actual: 0.178980, Forecast: 0.103600, Error: 0.075379
Using AR(10) for forecasting
Step 127: Synthetic history length 101, Actual: 0.178992, Forecast: 0.102179, Error: 0.076812
Using AR(10) for forecasting
Step 128: Synthetic history length 101, Actual: 0.178989, Forecast: 0.100727, Error: 0.078261
Using AR(10) for forecasting
Step 129: Synthetic history length 101, Actual: 0.178974, Forecast: 0.099245, Error: 0.079729
Using AR(10) for forecasting
Step 130: Synthetic history length 101, Actual: 0.178953, Forecast: 0.097736, Error: 0.081217
Using AR(10) for forecasting
Step 131: Synthetic history length 101, Actual: 0.178928, Forecast: 0.096200, Error: 0.082728
Using AR(10) for forecasting
Step 132: Synthetic history length 101, Actual: 0.178905, Forecast: 0.094641, Error: 0.084264
Using AR(10) for forecasting
Step 133: Synthetic history length 101, Actual: 0.178887, Forecast: 0.093061, Error: 0.085826
Using AR(10) for forecasting
Step 134: Synthetic history length 101, Actual: 0.178878, Forecast: 0.091463, Error: 0.087415
Using AR(10) for forecasting
Step 135: Synthetic history length 101, Actual: 0.178883, Forecast: 0.089848, Error: 0.089034
Using AR(10) for forecasting
Step 136: Synthetic history length 101, Actual: 0.178905, Forecast: 0.088222, Error: 0.090684
Using AR(10) for forecasting
Step 137: Synthetic history length 101, Actual: 0.178950, Forecast: 0.086585, Error: 0.092366
Using AR(10) for forecasting
Step 138: Synthetic history length 101, Actual: 0.179022, Forecast: 0.084941, Error: 0.094081
Using AR(10) for forecasting
Step 139: Synthetic history length 101, Actual: 0.179127, Forecast: 0.083294, Error: 0.095832
Using AR(10) for forecasting
Step 140: Synthetic history length 101, Actual: 0.179268, Forecast: 0.081646, Error: 0.097622
Using AR(10) for forecasting
Step 141: Synthetic history length 101, Actual: 0.179451, Forecast: 0.080000, Error: 0.099451
Using AR(10) for forecasting
Step 142: Synthetic history length 101, Actual: 0.179680, Forecast: 0.078359, Error: 0.101320
Using AR(10) for forecasting
Step 143: Synthetic history length 101, Actual: 0.179957, Forecast: 0.076726, Error: 0.103231
Using AR(10) for forecasting
Step 144: Synthetic history length 101, Actual: 0.180284, Forecast: 0.075102, Error: 0.105182
Using AR(10) for forecasting
Step 145: Synthetic history length 101, Actual: 0.180661, Forecast: 0.073490, Error: 0.107171
Using AR(10) for forecasting
Step 146: Synthetic history length 101, Actual: 0.181088, Forecast: 0.071891, Error: 0.109197
Using AR(10) for forecasting
Step 147: Synthetic history length 101, Actual: 0.181566, Forecast: 0.070307, Error: 0.111259
Using AR(10) for forecasting
Step 148: Synthetic history length 101, Actual: 0.182094, Forecast: 0.068740, Error: 0.113354
Using AR(10) for forecasting
Step 149: Synthetic history length 101, Actual: 0.182672, Forecast: 0.067189, Error: 0.115482
Using AR(10) for forecasting
Step 150: Synthetic history length 101, Actual: 0.183299, Forecast: 0.065656, Error: 0.117643
Using AR(10) for forecasting
Step 151: Synthetic history length 101, Actual: 0.183975, Forecast: 0.064140, Error: 0.119836
Using AR(10) for forecasting
Step 152: Synthetic history length 101, Actual: 0.184698, Forecast: 0.062640, Error: 0.122058
Using AR(10) for forecasting
Step 153: Synthetic history length 101, Actual: 0.185463, Forecast: 0.061156, Error: 0.124307
Using AR(10) for forecasting
Step 154: Synthetic history length 101, Actual: 0.186265, Forecast: 0.059686, Error: 0.126579
Using AR(10) for forecasting
Step 155: Synthetic history length 101, Actual: 0.187098, Forecast: 0.058228, Error: 0.128869
Using AR(10) for forecasting
Step 156: Synthetic history length 101, Actual: 0.187956, Forecast: 0.056781, Error: 0.131174
Using AR(10) for forecasting
Step 157: Synthetic history length 101, Actual: 0.188832, Forecast: 0.055342, Error: 0.133490
Using AR(10) for forecasting
Step 158: Synthetic history length 101, Actual: 0.189720, Forecast: 0.053907, Error: 0.135813
Using AR(10) for forecasting
Step 159: Synthetic history length 101, Actual: 0.190614, Forecast: 0.052474, Error: 0.138140
Using AR(10) for forecasting
Step 160: Synthetic history length 101, Actual: 0.191509, Forecast: 0.051039, Error: 0.140470
Using AR(10) for forecasting
Step 161: Synthetic history length 101, Actual: 0.192398, Forecast: 0.049599, Error: 0.142799
Using AR(10) for forecasting
Step 162: Synthetic history length 101, Actual: 0.193276, Forecast: 0.048149, Error: 0.145126
Using AR(10) for forecasting
Step 163: Synthetic history length 101, Actual: 0.194136, Forecast: 0.046686, Error: 0.147450
Using AR(10) for forecasting
Step 164: Synthetic history length 101, Actual: 0.194973, Forecast: 0.045206, Error: 0.149767
Using AR(10) for forecasting
Step 165: Synthetic history length 101, Actual: 0.195781, Forecast: 0.043704, Error: 0.152077
Using AR(10) for forecasting
Step 166: Synthetic history length 101, Actual: 0.196553, Forecast: 0.042177, Error: 0.154376
Using AR(10) for forecasting
Step 167: Synthetic history length 101, Actual: 0.197282, Forecast: 0.040621, Error: 0.156661
Using AR(10) for forecasting
Step 168: Synthetic history length 101, Actual: 0.197958, Forecast: 0.039032, Error: 0.158926
Using AR(10) for forecasting
Step 169: Synthetic history length 101, Actual: 0.198572, Forecast: 0.037407, Error: 0.161165
Using AR(10) for forecasting
Step 170: Synthetic history length 101, Actual: 0.199115, Forecast: 0.035743, Error: 0.163372
Using AR(10) for forecasting
Step 171: Synthetic history length 101, Actual: 0.199580, Forecast: 0.034038, Error: 0.165542
Using AR(10) for forecasting
Step 172: Synthetic history length 101, Actual: 0.199966, Forecast: 0.032289, Error: 0.167677
Using AR(10) for forecasting
Step 173: Synthetic history length 101, Actual: 0.200276, Forecast: 0.030495, Error: 0.169781
Using AR(10) for forecasting
Step 174: Synthetic history length 101, Actual: 0.200513, Forecast: 0.028653, Error: 0.171859
Using AR(10) for forecasting
Step 175: Synthetic history length 101, Actual: 0.200681, Forecast: 0.026765, Error: 0.173916
Using AR(10) for forecasting
Step 176: Synthetic history length 101, Actual: 0.200781, Forecast: 0.024830, Error: 0.175951
Using AR(10) for forecasting
Step 177: Synthetic history length 101, Actual: 0.200812, Forecast: 0.022849, Error: 0.177964
Using AR(10) for forecasting
Step 178: Synthetic history length 101, Actual: 0.200770, Forecast: 0.020822, Error: 0.179948
Using AR(10) for forecasting
Step 179: Synthetic history length 101, Actual: 0.200649, Forecast: 0.018752, Error: 0.181897
Using AR(10) for forecasting
Step 180: Synthetic history length 101, Actual: 0.200445, Forecast: 0.016642, Error: 0.183804
Using AR(10) for forecasting
Step 181: Synthetic history length 101, Actual: 0.200158, Forecast: 0.014494, Error: 0.185664
Using AR(10) for forecasting
Step 182: Synthetic history length 101, Actual: 0.199790, Forecast: 0.012313, Error: 0.187477
Using AR(10) for forecasting
Step 183: Synthetic history length 101, Actual: 0.199349, Forecast: 0.010103, Error: 0.189247
Using AR(10) for forecasting
Step 184: Synthetic history length 101, Actual: 0.198846, Forecast: 0.007868, Error: 0.190977
Using AR(10) for forecasting
Step 185: Synthetic history length 101, Actual: 0.198286, Forecast: 0.005615, Error: 0.192672
Using AR(10) for forecasting
Step 186: Synthetic history length 101, Actual: 0.197679, Forecast: 0.003348, Error: 0.194331
Using AR(10) for forecasting
Step 187: Synthetic history length 101, Actual: 0.197030, Forecast: 0.001075, Error: 0.195956
Using AR(10) for forecasting
Step 188: Synthetic history length 101, Actual: 0.196345, Forecast: -0.001199, Error: 0.197544
Using AR(10) for forecasting
Step 189: Synthetic history length 101, Actual: 0.195628, Forecast: -0.003468, Error: 0.199095
Using AR(10) for forecasting
Step 190: Synthetic history length 101, Actual: 0.194884, Forecast: -0.005723, Error: 0.200608
Using AR(10) for forecasting
Step 191: Synthetic history length 101, Actual: 0.194120, Forecast: -0.007960, Error: 0.202080
Using AR(10) for forecasting
Step 192: Synthetic history length 101, Actual: 0.193341, Forecast: -0.010171, Error: 0.203512
Using AR(10) for forecasting
Step 193: Synthetic history length 101, Actual: 0.192553, Forecast: -0.012350, Error: 0.204903
Using AR(10) for forecasting
Step 194: Synthetic history length 101, Actual: 0.191761, Forecast: -0.014491, Error: 0.206252
Using AR(10) for forecasting
Step 195: Synthetic history length 101, Actual: 0.190972, Forecast: -0.016589, Error: 0.207560
Using AR(10) for forecasting
Step 196: Synthetic history length 101, Actual: 0.190191, Forecast: -0.018638, Error: 0.208828
Using AR(10) for forecasting
Step 197: Synthetic history length 101, Actual: 0.189424, Forecast: -0.020633, Error: 0.210058
Using AR(10) for forecasting
Step 198: Synthetic history length 101, Actual: 0.188678, Forecast: -0.022572, Error: 0.211250
Using AR(10) for forecasting
Step 199: Synthetic history length 101, Actual: 0.187957, Forecast: -0.024450, Error: 0.212407
Using AR(10) for forecasting
Step 200: Synthetic history length 101, Actual: 0.187265, Forecast: -0.026266, Error: 0.213531
Using AR(10) for forecasting
Step 201: Synthetic history length 101, Actual: 0.186606, Forecast: -0.028018, Error: 0.214623
Using AR(10) for forecasting
Step 202: Synthetic history length 101, Actual: 0.185981, Forecast: -0.029705, Error: 0.215685
Using AR(10) for forecasting
Step 203: Synthetic history length 101, Actual: 0.185393, Forecast: -0.031327, Error: 0.216720
Using AR(10) for forecasting
Step 204: Synthetic history length 101, Actual: 0.184843, Forecast: -0.032887, Error: 0.217729
Using AR(10) for forecasting
Step 205: Synthetic history length 101, Actual: 0.184331, Forecast: -0.034385, Error: 0.218716
Using AR(10) for forecasting
Step 206: Synthetic history length 101, Actual: 0.183858, Forecast: -0.035826, Error: 0.219684
Using AR(10) for forecasting
Step 207: Synthetic history length 101, Actual: 0.183422, Forecast: -0.037214, Error: 0.220636
Using AR(10) for forecasting
Step 208: Synthetic history length 101, Actual: 0.183023, Forecast: -0.038553, Error: 0.221577
Using AR(10) for forecasting
Step 209: Synthetic history length 101, Actual: 0.182658, Forecast: -0.039850, Error: 0.222509
Using AR(10) for forecasting
Step 210: Synthetic history length 101, Actual: 0.182325, Forecast: -0.041111, Error: 0.223436
Using AR(10) for forecasting
Step 211: Synthetic history length 101, Actual: 0.182020, Forecast: -0.042344, Error: 0.224364
Using AR(10) for forecasting
Step 212: Synthetic history length 101, Actual: 0.181740, Forecast: -0.043556, Error: 0.225296
Using AR(10) for forecasting
Step 213: Synthetic history length 101, Actual: 0.181482, Forecast: -0.044756, Error: 0.226239
Using AR(10) for forecasting
Step 214: Synthetic history length 101, Actual: 0.181243, Forecast: -0.045954, Error: 0.227197
Using AR(10) for forecasting
Step 215: Synthetic history length 101, Actual: 0.181020, Forecast: -0.047157, Error: 0.228177
Using AR(10) for forecasting
Step 216: Synthetic history length 101, Actual: 0.180809, Forecast: -0.048376, Error: 0.229184
Using AR(10) for forecasting
Step 217: Synthetic history length 101, Actual: 0.180607, Forecast: -0.049620, Error: 0.230226
Using AR(10) for forecasting
Step 218: Synthetic history length 101, Actual: 0.180411, Forecast: -0.050897, Error: 0.231308
Using AR(10) for forecasting
Step 219: Synthetic history length 101, Actual: 0.180218, Forecast: -0.052217, Error: 0.232435
Using AR(10) for forecasting
Step 220: Synthetic history length 101, Actual: 0.180025, Forecast: -0.053589, Error: 0.233613
Using AR(10) for forecasting
Step 221: Synthetic history length 101, Actual: 0.179828, Forecast: -0.055019, Error: 0.234847
Using AR(10) for forecasting
Step 222: Synthetic history length 101, Actual: 0.179623, Forecast: -0.056515, Error: 0.236139
Using AR(10) for forecasting
Step 223: Synthetic history length 101, Actual: 0.179409, Forecast: -0.058084, Error: 0.237493
Using AR(10) for forecasting
Step 224: Synthetic history length 101, Actual: 0.179181, Forecast: -0.059730, Error: 0.238911
Using AR(10) for forecasting
Step 225: Synthetic history length 101, Actual: 0.178936, Forecast: -0.061458, Error: 0.240394
Using AR(10) for forecasting
Step 226: Synthetic history length 101, Actual: 0.178673, Forecast: -0.063271, Error: 0.241943
Using AR(10) for forecasting
Step 227: Synthetic history length 101, Actual: 0.178388, Forecast: -0.065169, Error: 0.243557
Using AR(10) for forecasting
Step 228: Synthetic history length 101, Actual: 0.178080, Forecast: -0.067155, Error: 0.245235
Using AR(10) for forecasting
Step 229: Synthetic history length 101, Actual: 0.177748, Forecast: -0.069226, Error: 0.246974
Using AR(10) for forecasting
Step 230: Synthetic history length 101, Actual: 0.177390, Forecast: -0.071381, Error: 0.248771
Using AR(10) for forecasting
Step 231: Synthetic history length 101, Actual: 0.177006, Forecast: -0.073614, Error: 0.250621
Using AR(10) for forecasting
Step 232: Synthetic history length 101, Actual: 0.176597, Forecast: -0.075922, Error: 0.252519
Using AR(10) for forecasting
Step 233: Synthetic history length 101, Actual: 0.176161, Forecast: -0.078296, Error: 0.254458
Using AR(10) for forecasting
Step 234: Synthetic history length 101, Actual: 0.175701, Forecast: -0.080730, Error: 0.256431
Using AR(10) for forecasting
Step 235: Synthetic history length 101, Actual: 0.175217, Forecast: -0.083213, Error: 0.258429
Using AR(10) for forecasting
Step 236: Synthetic history length 101, Actual: 0.174710, Forecast: -0.085734, Error: 0.260444
Using AR(10) for forecasting
Step 237: Synthetic history length 101, Actual: 0.174181, Forecast: -0.088283, Error: 0.262464
Using AR(10) for forecasting
Step 238: Synthetic history length 101, Actual: 0.173632, Forecast: -0.090847, Error: 0.264479
Using AR(10) for forecasting
Step 239: Synthetic history length 101, Actual: 0.173065, Forecast: -0.093412, Error: 0.266477
Using AR(10) for forecasting
Step 240: Synthetic history length 101, Actual: 0.172481, Forecast: -0.095964, Error: 0.268445
Using AR(10) for forecasting
Step 241: Synthetic history length 101, Actual: 0.171881, Forecast: -0.098489, Error: 0.270370
Using AR(10) for forecasting
Step 242: Synthetic history length 101, Actual: 0.171267, Forecast: -0.100973, Error: 0.272240
Using AR(10) for forecasting
Step 243: Synthetic history length 101, Actual: 0.170639, Forecast: -0.103401, Error: 0.274041
Using AR(10) for forecasting
Step 244: Synthetic history length 101, Actual: 0.170001, Forecast: -0.105759, Error: 0.275760
Using AR(10) for forecasting
Step 245: Synthetic history length 101, Actual: 0.169353, Forecast: -0.108032, Error: 0.277385
Using AR(10) for forecasting
Step 246: Synthetic history length 101, Actual: 0.168696, Forecast: -0.110207, Error: 0.278904
Using AR(10) for forecasting
Step 247: Synthetic history length 101, Actual: 0.168033, Forecast: -0.112273, Error: 0.280306
Using AR(10) for forecasting
Step 248: Synthetic history length 101, Actual: 0.167364, Forecast: -0.114218, Error: 0.281582
Using AR(10) for forecasting
Step 249: Synthetic history length 101, Actual: 0.166691, Forecast: -0.116031, Error: 0.282722
Using AR(10) for forecasting
Step 250: Synthetic history length 101, Actual: 0.166016, Forecast: -0.117705, Error: 0.283721
Using AR(10) for forecasting
Step 251: Synthetic history length 101, Actual: 0.165339, Forecast: -0.119231, Error: 0.284571
Using AR(10) for forecasting
Step 252: Synthetic history length 101, Actual: 0.164661, Forecast: -0.120606, Error: 0.285268
Using AR(10) for forecasting
Step 253: Synthetic history length 101, Actual: 0.163983, Forecast: -0.121826, Error: 0.285810
Using AR(10) for forecasting
Step 254: Synthetic history length 101, Actual: 0.163305, Forecast: -0.122890, Error: 0.286195
Using AR(10) for forecasting
Step 255: Synthetic history length 101, Actual: 0.162626, Forecast: -0.123799, Error: 0.286424
Using AR(10) for forecasting
Step 256: Synthetic history length 101, Actual: 0.161945, Forecast: -0.124555, Error: 0.286500
Using AR(10) for forecasting
Step 257: Synthetic history length 101, Actual: 0.161262, Forecast: -0.125164, Error: 0.286426
Using AR(10) for forecasting
Step 258: Synthetic history length 101, Actual: 0.160576, Forecast: -0.125634, Error: 0.286209
Using AR(10) for forecasting
Step 259: Synthetic history length 101, Actual: 0.159884, Forecast: -0.125973, Error: 0.285857
Using AR(10) for forecasting
Step 260: Synthetic history length 101, Actual: 0.159184, Forecast: -0.126194, Error: 0.285378
Using AR(10) for forecasting
Step 261: Synthetic history length 101, Actual: 0.158474, Forecast: -0.126310, Error: 0.284784
Using AR(10) for forecasting
Step 262: Synthetic history length 101, Actual: 0.157752, Forecast: -0.126337, Error: 0.284089
Using AR(10) for forecasting
Step 263: Synthetic history length 101, Actual: 0.157016, Forecast: -0.126290, Error: 0.283306
Using AR(10) for forecasting
Step 264: Synthetic history length 101, Actual: 0.156263, Forecast: -0.126189, Error: 0.282451
Using AR(10) for forecasting
Step 265: Synthetic history length 101, Actual: 0.155490, Forecast: -0.126052, Error: 0.281542
Using AR(10) for forecasting
Step 266: Synthetic history length 101, Actual: 0.154695, Forecast: -0.125900, Error: 0.280596
Using AR(10) for forecasting
Step 267: Synthetic history length 101, Actual: 0.153876, Forecast: -0.125755, Error: 0.279631
Using AR(10) for forecasting
Step 268: Synthetic history length 101, Actual: 0.153031, Forecast: -0.125637, Error: 0.278668
Using AR(10) for forecasting
Step 269: Synthetic history length 101, Actual: 0.152156, Forecast: -0.125568, Error: 0.277723
Using AR(10) for forecasting
Step 270: Synthetic history length 101, Actual: 0.151249, Forecast: -0.125568, Error: 0.276817
Using AR(10) for forecasting
Step 271: Synthetic history length 101, Actual: 0.150307, Forecast: -0.125658, Error: 0.275965
Using AR(10) for forecasting
Step 272: Synthetic history length 101, Actual: 0.149329, Forecast: -0.125858, Error: 0.275187
Using AR(10) for forecasting
Step 273: Synthetic history length 101, Actual: 0.148311, Forecast: -0.126185, Error: 0.274496
Using AR(10) for forecasting
Step 274: Synthetic history length 101, Actual: 0.147251, Forecast: -0.126657, Error: 0.273908
Using AR(10) for forecasting
Step 275: Synthetic history length 101, Actual: 0.146147, Forecast: -0.127287, Error: 0.273434
Using AR(10) for forecasting
Step 276: Synthetic history length 101, Actual: 0.144998, Forecast: -0.128089, Error: 0.273087
Using AR(10) for forecasting
Step 277: Synthetic history length 101, Actual: 0.143803, Forecast: -0.129071, Error: 0.272875
Using AR(10) for forecasting
Step 278: Synthetic history length 101, Actual: 0.142563, Forecast: -0.130243, Error: 0.272806
Using AR(10) for forecasting
Step 279: Synthetic history length 101, Actual: 0.141277, Forecast: -0.131608, Error: 0.272884
Using AR(10) for forecasting
Step 280: Synthetic history length 101, Actual: 0.139946, Forecast: -0.133167, Error: 0.273113
Using AR(10) for forecasting
Step 281: Synthetic history length 101, Actual: 0.138574, Forecast: -0.134919, Error: 0.273492
Using AR(10) for forecasting
Step 282: Synthetic history length 101, Actual: 0.137161, Forecast: -0.136859, Error: 0.274020
Using AR(10) for forecasting
Step 283: Synthetic history length 101, Actual: 0.135711, Forecast: -0.138979, Error: 0.274690
Using AR(10) for forecasting
Step 284: Synthetic history length 101, Actual: 0.134228, Forecast: -0.141267, Error: 0.275495
Using AR(10) for forecasting
Step 285: Synthetic history length 101, Actual: 0.132717, Forecast: -0.143709, Error: 0.276426
Using AR(10) for forecasting
Step 286: Synthetic history length 101, Actual: 0.131182, Forecast: -0.146287, Error: 0.277469
Using AR(10) for forecasting
Step 287: Synthetic history length 101, Actual: 0.129628, Forecast: -0.148981, Error: 0.278609
Using AR(10) for forecasting
Step 288: Synthetic history length 101, Actual: 0.128061, Forecast: -0.151767, Error: 0.279828
Using AR(10) for forecasting
Step 289: Synthetic history length 101, Actual: 0.126484, Forecast: -0.154620, Error: 0.281104
Using AR(10) for forecasting
Step 290: Synthetic history length 101, Actual: 0.124903, Forecast: -0.157513, Error: 0.282416
Using AR(10) for forecasting
Step 291: Synthetic history length 101, Actual: 0.123324, Forecast: -0.160415, Error: 0.283739
Using AR(10) for forecasting
Step 292: Synthetic history length 101, Actual: 0.121750, Forecast: -0.163296, Error: 0.285046
Using AR(10) for forecasting
Step 293: Synthetic history length 101, Actual: 0.120188, Forecast: -0.166123, Error: 0.286312
Using AR(10) for forecasting
Step 294: Synthetic history length 101, Actual: 0.118642, Forecast: -0.168866, Error: 0.287508
Using AR(10) for forecasting
Step 295: Synthetic history length 101, Actual: 0.117118, Forecast: -0.171491, Error: 0.288608
Using AR(10) for forecasting
Step 296: Synthetic history length 101, Actual: 0.115620, Forecast: -0.173966, Error: 0.289586
Using AR(10) for forecasting
Step 297: Synthetic history length 101, Actual: 0.114154, Forecast: -0.176260, Error: 0.290414
Using AR(10) for forecasting
Step 298: Synthetic history length 101, Actual: 0.112726, Forecast: -0.178344, Error: 0.291070
Using AR(10) for forecasting
Step 299: Synthetic history length 101, Actual: 0.111339, Forecast: -0.180191, Error: 0.291530
Using AR(10) for forecasting
Step 300: Synthetic history length 101, Actual: 0.109998, Forecast: -0.181774, Error: 0.291771
Using AR(10) for forecasting
Step 301: Synthetic history length 101, Actual: 0.108705, Forecast: -0.183071, Error: 0.291776
Using AR(10) for forecasting
Step 302: Synthetic history length 101, Actual: 0.107464, Forecast: -0.184063, Error: 0.291527
Using AR(10) for forecasting
Step 303: Synthetic history length 101, Actual: 0.106275, Forecast: -0.184735, Error: 0.291010
Using AR(10) for forecasting
Step 304: Synthetic history length 101, Actual: 0.105140, Forecast: -0.185075, Error: 0.290215
Using AR(10) for forecasting
Step 305: Synthetic history length 101, Actual: 0.104060, Forecast: -0.185075, Error: 0.289135
Using AR(10) for forecasting
Step 306: Synthetic history length 101, Actual: 0.103034, Forecast: -0.184733, Error: 0.287767
Using AR(10) for forecasting
Step 307: Synthetic history length 101, Actual: 0.102061, Forecast: -0.184051, Error: 0.286112
Using AR(10) for forecasting
Step 308: Synthetic history length 101, Actual: 0.101140, Forecast: -0.183036, Error: 0.284176
Using AR(10) for forecasting
Step 309: Synthetic history length 101, Actual: 0.100269, Forecast: -0.181699, Error: 0.281967
Using AR(10) for forecasting
Step 310: Synthetic history length 101, Actual: 0.099444, Forecast: -0.180057, Error: 0.279501
Using AR(10) for forecasting
Step 311: Synthetic history length 101, Actual: 0.098665, Forecast: -0.178131, Error: 0.276796
Using AR(10) for forecasting
Step 312: Synthetic history length 101, Actual: 0.097927, Forecast: -0.175948, Error: 0.273875
Using AR(10) for forecasting
Step 313: Synthetic history length 101, Actual: 0.097228, Forecast: -0.173537, Error: 0.270765
Using AR(10) for forecasting
Step 314: Synthetic history length 101, Actual: 0.096565, Forecast: -0.170933, Error: 0.267498
Using AR(10) for forecasting
Step 315: Synthetic history length 101, Actual: 0.095936, Forecast: -0.168174, Error: 0.264111
Using AR(10) for forecasting
Step 316: Synthetic history length 101, Actual: 0.095339, Forecast: -0.165302, Error: 0.260640
Using AR(10) for forecasting
Step 317: Synthetic history length 101, Actual: 0.094769, Forecast: -0.162359, Error: 0.257128
Using AR(10) for forecasting
Step 318: Synthetic history length 101, Actual: 0.094225, Forecast: -0.159392, Error: 0.253617
Using AR(10) for forecasting
Step 319: Synthetic history length 101, Actual: 0.093705, Forecast: -0.156448, Error: 0.250153
Using AR(10) for forecasting
Step 320: Synthetic history length 101, Actual: 0.093204, Forecast: -0.153576, Error: 0.246780
Using AR(10) for forecasting
Step 321: Synthetic history length 101, Actual: 0.092721, Forecast: -0.150824, Error: 0.243545
Using AR(10) for forecasting
Step 322: Synthetic history length 101, Actual: 0.092254, Forecast: -0.148240, Error: 0.240494
Using AR(10) for forecasting
Step 323: Synthetic history length 101, Actual: 0.091800, Forecast: -0.145870, Error: 0.237670
Using AR(10) for forecasting
Step 324: Synthetic history length 101, Actual: 0.091359, Forecast: -0.143758, Error: 0.235117
Using AR(10) for forecasting
Step 325: Synthetic history length 101, Actual: 0.090930, Forecast: -0.141947, Error: 0.232877
Using AR(10) for forecasting
Step 326: Synthetic history length 101, Actual: 0.090515, Forecast: -0.140473, Error: 0.230988
Using AR(10) for forecasting
Step 327: Synthetic history length 101, Actual: 0.090115, Forecast: -0.139371, Error: 0.229486
Using AR(10) for forecasting
Step 328: Synthetic history length 101, Actual: 0.089732, Forecast: -0.138670, Error: 0.228403
Using AR(10) for forecasting
Step 329: Synthetic history length 101, Actual: 0.089371, Forecast: -0.138394, Error: 0.227764
Using AR(10) for forecasting
Step 330: Synthetic history length 101, Actual: 0.089034, Forecast: -0.138558, Error: 0.227593
Using AR(10) for forecasting
Step 331: Synthetic history length 101, Actual: 0.088729, Forecast: -0.139176, Error: 0.227905
Using AR(10) for forecasting
Step 332: Synthetic history length 101, Actual: 0.088459, Forecast: -0.140251, Error: 0.228710
Using AR(10) for forecasting
Step 333: Synthetic history length 101, Actual: 0.088232, Forecast: -0.141780, Error: 0.230012
Using AR(10) for forecasting
Step 334: Synthetic history length 101, Actual: 0.088053, Forecast: -0.143753, Error: 0.231806
Using AR(10) for forecasting
Step 335: Synthetic history length 101, Actual: 0.087928, Forecast: -0.146154, Error: 0.234082
Using AR(10) for forecasting
Step 336: Synthetic history length 101, Actual: 0.087864, Forecast: -0.148957, Error: 0.236821
Using AR(10) for forecasting
Step 337: Synthetic history length 101, Actual: 0.087866, Forecast: -0.152130, Error: 0.239996
Using AR(10) for forecasting
Step 338: Synthetic history length 101, Actual: 0.087940, Forecast: -0.155636, Error: 0.243576
Using AR(10) for forecasting
Step 339: Synthetic history length 101, Actual: 0.088092, Forecast: -0.159428, Error: 0.247520
Using AR(10) for forecasting
Step 340: Synthetic history length 101, Actual: 0.088330, Forecast: -0.163455, Error: 0.251786
Using AR(10) for forecasting
Step 341: Synthetic history length 101, Actual: 0.088661, Forecast: -0.167662, Error: 0.256323
Using AR(10) for forecasting
Step 342: Synthetic history length 101, Actual: 0.089095, Forecast: -0.171985, Error: 0.261080
Using AR(10) for forecasting
Step 343: Synthetic history length 101, Actual: 0.089641, Forecast: -0.176359, Error: 0.266000
Using AR(10) for forecasting
Step 344: Synthetic history length 101, Actual: 0.090305, Forecast: -0.180716, Error: 0.271021
Using AR(10) for forecasting
Step 345: Synthetic history length 101, Actual: 0.091090, Forecast: -0.184983, Error: 0.276074
Using AR(10) for forecasting
Step 346: Synthetic history length 101, Actual: 0.091993, Forecast: -0.189090, Error: 0.281083
Using AR(10) for forecasting
Step 347: Synthetic history length 101, Actual: 0.093009, Forecast: -0.192963, Error: 0.285972
Using AR(10) for forecasting
Step 348: Synthetic history length 101, Actual: 0.094134, Forecast: -0.196530, Error: 0.290664
Using AR(10) for forecasting
Step 349: Synthetic history length 101, Actual: 0.095369, Forecast: -0.199722, Error: 0.295091
Using AR(10) for forecasting
Step 350: Synthetic history length 101, Actual: 0.096715, Forecast: -0.202472, Error: 0.299187
Using AR(10) for forecasting
Step 351: Synthetic history length 101, Actual: 0.098174, Forecast: -0.204717, Error: 0.302892
Using AR(10) for forecasting
Step 352: Synthetic history length 101, Actual: 0.099746, Forecast: -0.206401, Error: 0.306147
Using AR(10) for forecasting
Step 353: Synthetic history length 101, Actual: 0.101424, Forecast: -0.207472, Error: 0.308895
Using AR(10) for forecasting
Step 354: Synthetic history length 101, Actual: 0.103196, Forecast: -0.207886, Error: 0.311082
Using AR(10) for forecasting
Step 355: Synthetic history length 101, Actual: 0.105047, Forecast: -0.207608, Error: 0.312655
Using AR(10) for forecasting
Step 356: Synthetic history length 101, Actual: 0.106963, Forecast: -0.206611, Error: 0.313574
Using AR(10) for forecasting
Step 357: Synthetic history length 101, Actual: 0.108931, Forecast: -0.204879, Error: 0.313810
Using AR(10) for forecasting
Step 358: Synthetic history length 101, Actual: 0.110939, Forecast: -0.202403, Error: 0.313342
Using AR(10) for forecasting
Step 359: Synthetic history length 101, Actual: 0.112976, Forecast: -0.199188, Error: 0.312164
Using AR(10) for forecasting
Step 360: Synthetic history length 101, Actual: 0.115030, Forecast: -0.195249, Error: 0.310279
Using AR(10) for forecasting
Step 361: Synthetic history length 101, Actual: 0.117089, Forecast: -0.190610, Error: 0.307699
Using AR(10) for forecasting
Step 362: Synthetic history length 101, Actual: 0.119141, Forecast: -0.185309, Error: 0.304450
Using AR(10) for forecasting
Step 363: Synthetic history length 101, Actual: 0.121175, Forecast: -0.179392, Error: 0.300567
Using AR(10) for forecasting
Step 364: Synthetic history length 101, Actual: 0.123175, Forecast: -0.172917, Error: 0.296093
Using AR(10) for forecasting
Step 365: Synthetic history length 101, Actual: 0.125130, Forecast: -0.165953, Error: 0.291082
Using AR(10) for forecasting
Step 366: Synthetic history length 101, Actual: 0.127024, Forecast: -0.158575, Error: 0.285599
Using AR(10) for forecasting
Step 367: Synthetic history length 101, Actual: 0.128850, Forecast: -0.150868, Error: 0.279718
Using AR(10) for forecasting
Step 368: Synthetic history length 101, Actual: 0.130601, Forecast: -0.142925, Error: 0.273527
Using AR(10) for forecasting
Step 369: Synthetic history length 101, Actual: 0.132278, Forecast: -0.134845, Error: 0.267123
Using AR(10) for forecasting
Step 370: Synthetic history length 101, Actual: 0.133881, Forecast: -0.126730, Error: 0.260611
Using AR(10) for forecasting
Step 371: Synthetic history length 101, Actual: 0.135412, Forecast: -0.118687, Error: 0.254099
Using AR(10) for forecasting
Step 372: Synthetic history length 101, Actual: 0.136873, Forecast: -0.110825, Error: 0.247698
Using AR(10) for forecasting
Step 373: Synthetic history length 101, Actual: 0.138267, Forecast: -0.103253, Error: 0.241520
Using AR(10) for forecasting
Step 374: Synthetic history length 101, Actual: 0.139603, Forecast: -0.096080, Error: 0.235683
Using AR(10) for forecasting
Step 375: Synthetic history length 101, Actual: 0.140898, Forecast: -0.089410, Error: 0.230308
Using AR(10) for forecasting
Step 376: Synthetic history length 101, Actual: 0.142170, Forecast: -0.083343, Error: 0.225513
Using AR(10) for forecasting
Step 377: Synthetic history length 101, Actual: 0.143444, Forecast: -0.077975, Error: 0.221418
Using AR(10) for forecasting
Step 378: Synthetic history length 101, Actual: 0.144745, Forecast: -0.073391, Error: 0.218136
Using AR(10) for forecasting
Step 379: Synthetic history length 101, Actual: 0.146102, Forecast: -0.069669, Error: 0.215771
Using AR(10) for forecasting
Step 380: Synthetic history length 101, Actual: 0.147540, Forecast: -0.066876, Error: 0.214415
Using AR(10) for forecasting
Step 381: Synthetic history length 101, Actual: 0.149069, Forecast: -0.065065, Error: 0.214134
Using AR(10) for forecasting
Step 382: Synthetic history length 101, Actual: 0.150684, Forecast: -0.064277, Error: 0.214961
Using AR(10) for forecasting
Step 383: Synthetic history length 101, Actual: 0.152354, Forecast: -0.064540, Error: 0.216894
Using AR(10) for forecasting
Step 384: Synthetic history length 101, Actual: 0.154093, Forecast: -0.065865, Error: 0.219958
Using AR(10) for forecasting
Step 385: Synthetic history length 101, Actual: 0.156030, Forecast: -0.068247, Error: 0.224277
Using AR(10) for forecasting
Step 386: Synthetic history length 101, Actual: 0.157837, Forecast: -0.071665, Error: 0.229503
Using AR(10) for forecasting
Step 387: Synthetic history length 101, Actual: 0.159781, Forecast: -0.076083, Error: 0.235864
Using AR(10) for forecasting
Step 388: Synthetic history length 101, Actual: 0.163205, Forecast: -0.081446, Error: 0.244651
Using AR(10) for forecasting
Step 389: Synthetic history length 101, Actual: 0.167449, Forecast: -0.087686, Error: 0.255135
Using AR(10) for forecasting
Step 390: Synthetic history length 101, Actual: 0.171586, Forecast: -0.094715, Error: 0.266302
Using AR(10) for forecasting
Step 391: Synthetic history length 101, Actual: 0.175416, Forecast: -0.102435, Error: 0.277851
Using AR(10) for forecasting
Step 392: Synthetic history length 101, Actual: 0.179165, Forecast: -0.110731, Error: 0.289896
Using AR(10) for forecasting
Step 393: Synthetic history length 101, Actual: 0.182635, Forecast: -0.119476, Error: 0.302111
Using AR(10) for forecasting
Step 394: Synthetic history length 101, Actual: 0.185843, Forecast: -0.128533, Error: 0.314376
Using AR(10) for forecasting
Step 395: Synthetic history length 101, Actual: 0.189589, Forecast: -0.137755, Error: 0.327344
Using AR(10) for forecasting
Step 396: Synthetic history length 101, Actual: 0.194664, Forecast: -0.146987, Error: 0.341651
Using AR(10) for forecasting
Step 397: Synthetic history length 101, Actual: 0.200484, Forecast: -0.156070, Error: 0.356553
Using AR(10) for forecasting
Step 398: Synthetic history length 101, Actual: 0.206014, Forecast: -0.164841, Error: 0.370854
Using AR(10) for forecasting
Step 399: Synthetic history length 101, Actual: 0.211654, Forecast: -0.173136, Error: 0.384790
Using AR(10) for forecasting
Step 400: Synthetic history length 101, Actual: 0.217416, Forecast: -0.180795, Error: 0.398211
Using AR(10) for forecasting
Step 401: Synthetic history length 101, Actual: 0.223191, Forecast: -0.187659, Error: 0.410850
Using AR(10) for forecasting
Step 402: Synthetic history length 101, Actual: 0.229027, Forecast: -0.193578, Error: 0.422604
Using AR(10) for forecasting
Step 403: Synthetic history length 101, Actual: 0.234912, Forecast: -0.198409, Error: 0.433322
Using AR(9) for forecasting
Step 404: Synthetic history length 101, Actual: 0.240811, Forecast: -0.202024, Error: 0.442834
Using AR(9) for forecasting
Step 405: Synthetic history length 101, Actual: 0.246702, Forecast: -0.204305, Error: 0.451007
Using AR(9) for forecasting
Step 406: Synthetic history length 101, Actual: 0.252586, Forecast: -0.205152, Error: 0.457738
Using AR(9) for forecasting
Step 407: Synthetic history length 101, Actual: 0.258384, Forecast: -0.204484, Error: 0.462868
Using AR(9) for forecasting
Step 408: Synthetic history length 101, Actual: 0.264180, Forecast: -0.202238, Error: 0.466418
Using AR(9) for forecasting
Step 409: Synthetic history length 101, Actual: 0.270015, Forecast: -0.198374, Error: 0.468389
Using AR(9) for forecasting
Step 410: Synthetic history length 101, Actual: 0.275524, Forecast: -0.192874, Error: 0.468397
Using AR(9) for forecasting
Step 411: Synthetic history length 101, Actual: 0.280237, Forecast: -0.185743, Error: 0.465981
Using AR(9) for forecasting
Step 412: Synthetic history length 101, Actual: 0.284320, Forecast: -0.177013, Error: 0.461333
Using AR(9) for forecasting
Step 413: Synthetic history length 101, Actual: 0.288434, Forecast: -0.166738, Error: 0.455172
Using AR(9) for forecasting
Step 414: Synthetic history length 101, Actual: 0.292750, Forecast: -0.154997, Error: 0.447747
Using AR(9) for forecasting
Step 415: Synthetic history length 101, Actual: 0.297072, Forecast: -0.141896, Error: 0.438968
Using AR(9) for forecasting
Step 416: Synthetic history length 101, Actual: 0.301465, Forecast: -0.127561, Error: 0.429026
Using AR(9) for forecasting
Step 417: Synthetic history length 101, Actual: 0.306075, Forecast: -0.112143, Error: 0.418217
Using AR(9) for forecasting
Step 418: Synthetic history length 101, Actual: 0.309922, Forecast: -0.095811, Error: 0.405734
Using AR(9) for forecasting
Step 419: Synthetic history length 101, Actual: 0.312948, Forecast: -0.078757, Error: 0.391705
Using AR(9) for forecasting
Step 420: Synthetic history length 101, Actual: 0.315644, Forecast: -0.061185, Error: 0.376829
Using AR(9) for forecasting
Step 421: Synthetic history length 101, Actual: 0.318218, Forecast: -0.043317, Error: 0.361535
Using AR(9) for forecasting
Step 422: Synthetic history length 101, Actual: 0.320694, Forecast: -0.025384, Error: 0.346077
Using AR(9) for forecasting
Step 423: Synthetic history length 101, Actual: 0.323069, Forecast: -0.007625, Error: 0.330694
Using AR(9) for forecasting
Step 424: Synthetic history length 101, Actual: 0.325347, Forecast: 0.009714, Error: 0.315632
Using AR(9) for forecasting
Step 425: Synthetic history length 101, Actual: 0.327509, Forecast: 0.026389, Error: 0.301120
Using AR(9) for forecasting
Step 426: Synthetic history length 101, Actual: 0.329546, Forecast: 0.042155, Error: 0.287391
Using AR(9) for forecasting
Step 427: Synthetic history length 101, Actual: 0.331461, Forecast: 0.056776, Error: 0.274686
Using AR(9) for forecasting
Step 428: Synthetic history length 101, Actual: 0.333273, Forecast: 0.070023, Error: 0.263250
Using AR(9) for forecasting
Step 429: Synthetic history length 101, Actual: 0.334999, Forecast: 0.081684, Error: 0.253315
Using AR(9) for forecasting
Step 430: Synthetic history length 101, Actual: 0.336659, Forecast: 0.091560, Error: 0.245099
Using AR(9) for forecasting
Step 431: Synthetic history length 101, Actual: 0.338270, Forecast: 0.099477, Error: 0.238793
Using AR(9) for forecasting
Step 432: Synthetic history length 101, Actual: 0.339844, Forecast: 0.105282, Error: 0.234562
Using AR(9) for forecasting
Step 433: Synthetic history length 101, Actual: 0.341393, Forecast: 0.108851, Error: 0.232542
Using AR(9) for forecasting
Step 434: Synthetic history length 101, Actual: 0.342924, Forecast: 0.110087, Error: 0.232838
Using AR(9) for forecasting
Step 435: Synthetic history length 101, Actual: 0.344444, Forecast: 0.108928, Error: 0.235517
Using AR(9) for forecasting
Step 436: Synthetic history length 101, Actual: 0.345956, Forecast: 0.105344, Error: 0.240612
Using AR(9) for forecasting
Step 437: Synthetic history length 101, Actual: 0.347460, Forecast: 0.099343, Error: 0.248118
Using AR(9) for forecasting
Step 438: Synthetic history length 101, Actual: 0.348956, Forecast: 0.090966, Error: 0.257990
Using AR(9) for forecasting
Step 439: Synthetic history length 101, Actual: 0.350441, Forecast: 0.080295, Error: 0.270146
Using AR(9) for forecasting
Step 440: Synthetic history length 101, Actual: 0.351911, Forecast: 0.067446, Error: 0.284465
Using AR(9) for forecasting
Step 441: Synthetic history length 101, Actual: 0.353360, Forecast: 0.052574, Error: 0.300787
Using AR(9) for forecasting
Step 442: Synthetic history length 101, Actual: 0.354785, Forecast: 0.035867, Error: 0.318918
Using AR(9) for forecasting
Step 443: Synthetic history length 101, Actual: 0.356180, Forecast: 0.017548, Error: 0.338633
Using AR(9) for forecasting
Step 444: Synthetic history length 101, Actual: 0.357541, Forecast: -0.002129, Error: 0.359670
Using AR(9) for forecasting
Step 445: Synthetic history length 101, Actual: 0.358861, Forecast: -0.022882, Error: 0.381743
Using AR(9) for forecasting
Step 446: Synthetic history length 101, Actual: 0.360137, Forecast: -0.044402, Error: 0.404539
Using AR(9) for forecasting
Step 447: Synthetic history length 101, Actual: 0.361364, Forecast: -0.066361, Error: 0.427724
Using AR(9) for forecasting
Step 448: Synthetic history length 101, Actual: 0.362535, Forecast: -0.088412, Error: 0.450947
Using AR(9) for forecasting
Step 449: Synthetic history length 101, Actual: 0.363646, Forecast: -0.110197, Error: 0.473844
Using AR(9) for forecasting
Step 450: Synthetic history length 101, Actual: 0.364692, Forecast: -0.131351, Error: 0.496043
Using AR(9) for forecasting
Step 451: Synthetic history length 101, Actual: 0.365668, Forecast: -0.151504, Error: 0.517172
Using AR(9) for forecasting
Step 452: Synthetic history length 101, Actual: 0.366571, Forecast: -0.170292, Error: 0.536863
Using AR(9) for forecasting
Step 453: Synthetic history length 101, Actual: 0.367398, Forecast: -0.187360, Error: 0.554758
Using AR(9) for forecasting
Step 454: Synthetic history length 101, Actual: 0.368147, Forecast: -0.202365, Error: 0.570512
Using AR(9) for forecasting
Step 455: Synthetic history length 101, Actual: 0.368819, Forecast: -0.214986, Error: 0.583805
Using AR(9) for forecasting
Step 456: Synthetic history length 101, Actual: 0.369414, Forecast: -0.224928, Error: 0.594342
Using AR(9) for forecasting
Step 457: Synthetic history length 101, Actual: 0.369933, Forecast: -0.231924, Error: 0.601858
Using AR(9) for forecasting
Step 458: Synthetic history length 101, Actual: 0.370379, Forecast: -0.235747, Error: 0.606126
Using AR(9) for forecasting
Step 459: Synthetic history length 101, Actual: 0.370757, Forecast: -0.236206, Error: 0.606963
Using AR(9) for forecasting
Step 460: Synthetic history length 101, Actual: 0.371070, Forecast: -0.233158, Error: 0.604228
Using AR(9) for forecasting
Step 461: Synthetic history length 101, Actual: 0.371326, Forecast: -0.226505, Error: 0.597830
Using AR(9) for forecasting
Step 462: Synthetic history length 101, Actual: 0.371528, Forecast: -0.216202, Error: 0.587730
Using AR(10) for forecasting
Step 463: Synthetic history length 101, Actual: 0.371684, Forecast: -0.202257, Error: 0.573940
Using AR(10) for forecasting
Step 464: Synthetic history length 101, Actual: 0.371798, Forecast: -0.184732, Error: 0.556529
Using AR(10) for forecasting
Step 465: Synthetic history length 101, Actual: 0.371876, Forecast: -0.163745, Error: 0.535621
Using AR(10) for forecasting
Step 466: Synthetic history length 101, Actual: 0.371925, Forecast: -0.139471, Error: 0.511396
Using AR(10) for forecasting
Step 467: Synthetic history length 101, Actual: 0.371949, Forecast: -0.112138, Error: 0.484087
Using AR(10) for forecasting
Step 468: Synthetic history length 101, Actual: 0.371954, Forecast: -0.082028, Error: 0.453982
Using AR(10) for forecasting
Step 469: Synthetic history length 101, Actual: 0.371947, Forecast: -0.049473, Error: 0.421420
Using AR(10) for forecasting
Step 470: Synthetic history length 101, Actual: 0.371932, Forecast: -0.014853, Error: 0.386785
Using AR(10) for forecasting
Step 471: Synthetic history length 101, Actual: 0.371916, Forecast: 0.021410, Error: 0.350506
Using AR(10) for forecasting
Step 472: Synthetic history length 101, Actual: 0.371902, Forecast: 0.058854, Error: 0.313048
Using AR(10) for forecasting
Step 473: Synthetic history length 101, Actual: 0.371895, Forecast: 0.096988, Error: 0.274907
Using AR(10) for forecasting
Step 474: Synthetic history length 101, Actual: 0.371896, Forecast: 0.135291, Error: 0.236605
Using AR(10) for forecasting
Step 475: Synthetic history length 101, Actual: 0.371908, Forecast: 0.173227, Error: 0.198681
Using AR(10) for forecasting
Step 476: Synthetic history length 101, Actual: 0.371929, Forecast: 0.210245, Error: 0.161684
Using AR(10) for forecasting
Step 477: Synthetic history length 101, Actual: 0.371958, Forecast: 0.245793, Error: 0.126165
Using AR(10) for forecasting
Step 478: Synthetic history length 101, Actual: 0.371992, Forecast: 0.279322, Error: 0.092670
Using AR(10) for forecasting
Step 479: Synthetic history length 101, Actual: 0.372029, Forecast: 0.310296, Error: 0.061733
Using AR(10) for forecasting
Step 480: Synthetic history length 101, Actual: 0.372062, Forecast: 0.338201, Error: 0.033861
Using AR(10) for forecasting
Step 481: Synthetic history length 101, Actual: 0.372088, Forecast: 0.362553, Error: 0.009536
Using AR(8) for forecasting
Step 482: Synthetic history length 101, Actual: 0.372102, Forecast: 0.382904, Error: 0.010802
Using AR(8) for forecasting
Step 483: Synthetic history length 101, Actual: 0.372098, Forecast: 0.398854, Error: 0.026755
Using AR(8) for forecasting
Step 484: Synthetic history length 101, Actual: 0.372072, Forecast: 0.410054, Error: 0.037982
Using AR(8) for forecasting
Step 485: Synthetic history length 101, Actual: 0.372019, Forecast: 0.416219, Error: 0.044200
Using AR(8) for forecasting
Step 486: Synthetic history length 101, Actual: 0.371933, Forecast: 0.417125, Error: 0.045193
Using AR(6) for forecasting
Step 487: Synthetic history length 101, Actual: 0.371809, Forecast: 0.412625, Error: 0.040816
Using AR(6) for forecasting
Step 488: Synthetic history length 101, Actual: 0.371643, Forecast: 0.402645, Error: 0.031002
Using AR(6) for forecasting
Step 489: Synthetic history length 101, Actual: 0.371428, Forecast: 0.387192, Error: 0.015763
Using AR(9) for forecasting
Step 490: Synthetic history length 101, Actual: 0.371161, Forecast: 0.366354, Error: 0.004807
Using AR(9) for forecasting
Step 491: Synthetic history length 101, Actual: 0.370836, Forecast: 0.340305, Error: 0.030531
Using AR(6) for forecasting
Step 492: Synthetic history length 101, Actual: 0.370449, Forecast: 0.309301, Error: 0.061147
Using AR(6) for forecasting
Step 493: Synthetic history length 101, Actual: 0.369994, Forecast: 0.273680, Error: 0.096314
Using AR(6) for forecasting
Step 494: Synthetic history length 101, Actual: 0.369469, Forecast: 0.233860, Error: 0.135609
Using AR(9) for forecasting
Step 495: Synthetic history length 101, Actual: 0.368869, Forecast: 0.190335, Error: 0.178534
Using AR(9) for forecasting
Step 496: Synthetic history length 101, Actual: 0.368192, Forecast: 0.143672, Error: 0.224521
Using AR(9) for forecasting
Step 497: Synthetic history length 101, Actual: 0.367435, Forecast: 0.094499, Error: 0.272936
Using AR(6) for forecasting
Step 498: Synthetic history length 101, Actual: 0.366595, Forecast: 0.043507, Error: 0.323089
Using AR(6) for forecasting
Step 499: Synthetic history length 101, Actual: 0.365671, Forecast: -0.008571, Error: 0.374241
Using AR(6) for forecasting
Step 500: Synthetic history length 101, Actual: 0.364659, Forecast: -0.060956, Error: 0.425615
Using AR(6) for forecasting
Step 501: Synthetic history length 101, Actual: 0.363559, Forecast: -0.112843, Error: 0.476402
Using AR(6) for forecasting
Step 502: Synthetic history length 101, Actual: 0.362368, Forecast: -0.163411, Error: 0.525778
Using AR(6) for forecasting
Step 503: Synthetic history length 101, Actual: 0.361084, Forecast: -0.211828, Error: 0.572913
Using AR(6) for forecasting
Step 504: Synthetic history length 101, Actual: 0.359707, Forecast: -0.257274, Error: 0.616980
Using AR(6) for forecasting
Step 505: Synthetic history length 101, Actual: 0.358232, Forecast: -0.298942, Error: 0.657175
Using AR(6) for forecasting
Step 506: Synthetic history length 101, Actual: 0.356660, Forecast: -0.336061, Error: 0.692721
Using AR(6) for forecasting
Step 507: Synthetic history length 101, Actual: 0.354987, Forecast: -0.367901, Error: 0.722887
Using AR(6) for forecasting
Step 508: Synthetic history length 101, Actual: 0.353211, Forecast: -0.393789, Error: 0.747000
Using AR(6) for forecasting
Step 509: Synthetic history length 101, Actual: 0.351331, Forecast: -0.413121, Error: 0.764452
Using AR(6) for forecasting
Step 510: Synthetic history length 101, Actual: 0.349345, Forecast: -0.425372, Error: 0.774717
Using AR(6) for forecasting
Step 511: Synthetic history length 101, Actual: 0.347254, Forecast: -0.430107, Error: 0.777361
Using AR(6) for forecasting
Step 512: Synthetic history length 101, Actual: 0.345058, Forecast: -0.426989, Error: 0.772047
Using AR(6) for forecasting
Step 513: Synthetic history length 101, Actual: 0.342760, Forecast: -0.415789, Error: 0.758550
Using AR(6) for forecasting
Step 514: Synthetic history length 101, Actual: 0.340364, Forecast: -0.396394, Error: 0.736758
Using AR(6) for forecasting
Step 515: Synthetic history length 101, Actual: 0.337874, Forecast: -0.368807, Error: 0.706681
Using AR(6) for forecasting
Step 516: Synthetic history length 101, Actual: 0.335296, Forecast: -0.333157, Error: 0.668453
Using AR(6) for forecasting
Step 517: Synthetic history length 101, Actual: 0.332638, Forecast: -0.289697, Error: 0.622335
Using AR(6) for forecasting
Step 518: Synthetic history length 101, Actual: 0.329909, Forecast: -0.238806, Error: 0.568714
Using AR(6) for forecasting
Step 519: Synthetic history length 101, Actual: 0.327118, Forecast: -0.180986, Error: 0.508104
Using AR(6) for forecasting
Step 520: Synthetic history length 101, Actual: 0.324278, Forecast: -0.116859, Error: 0.441137
Using AR(6) for forecasting
Step 521: Synthetic history length 101, Actual: 0.321398, Forecast: -0.047164, Error: 0.368562
Using AR(6) for forecasting
Step 522: Synthetic history length 101, Actual: 0.318489, Forecast: 0.027257, Error: 0.291231
Using AR(6) for forecasting
Step 523: Synthetic history length 101, Actual: 0.315561, Forecast: 0.105462, Error: 0.210099
Using AR(6) for forecasting
Step 524: Synthetic history length 101, Actual: 0.312625, Forecast: 0.186422, Error: 0.126203
Using AR(6) for forecasting
Step 525: Synthetic history length 101, Actual: 0.309692, Forecast: 0.269034, Error: 0.040658
Using AR(6) for forecasting
Step 526: Synthetic history length 101, Actual: 0.306772, Forecast: 0.352135, Error: 0.045364
Using AR(6) for forecasting
Step 527: Synthetic history length 101, Actual: 0.303876, Forecast: 0.434519, Error: 0.130644
Using AR(6) for forecasting
Step 528: Synthetic history length 101, Actual: 0.301015, Forecast: 0.514951, Error: 0.213936
Using AR(6) for forecasting
Step 529: Synthetic history length 101, Actual: 0.298199, Forecast: 0.592187, Error: 0.293987
Using AR(6) for forecasting
Step 530: Synthetic history length 101, Actual: 0.295437, Forecast: 0.664989, Error: 0.369552
Using AR(6) for forecasting
Step 531: Synthetic history length 101, Actual: 0.292732, Forecast: 0.732148, Error: 0.439416
Using AR(6) for forecasting
Step 532: Synthetic history length 101, Actual: 0.290090, Forecast: 0.792503, Error: 0.502413
Using AR(6) for forecasting
Step 533: Synthetic history length 101, Actual: 0.287510, Forecast: 0.844953, Error: 0.557443
Using AR(6) for forecasting
Step 534: Synthetic history length 101, Actual: 0.284990, Forecast: 0.888485, Error: 0.603495
Using AR(6) for forecasting
Step 535: Synthetic history length 101, Actual: 0.282529, Forecast: 0.922186, Error: 0.639658
Using AR(6) for forecasting
Step 536: Synthetic history length 101, Actual: 0.280117, Forecast: 0.945261, Error: 0.665144
Using AR(6) for forecasting
Step 537: Synthetic history length 101, Actual: 0.277748, Forecast: 0.957049, Error: 0.679301
Using AR(6) for forecasting
Step 538: Synthetic history length 101, Actual: 0.275411, Forecast: 0.957038, Error: 0.681627
Using AR(6) for forecasting
Step 539: Synthetic history length 101, Actual: 0.273095, Forecast: 0.944875, Error: 0.671780
Using AR(6) for forecasting
Step 540: Synthetic history length 101, Actual: 0.270789, Forecast: 0.920379, Error: 0.649590
Using AR(6) for forecasting
Step 541: Synthetic history length 101, Actual: 0.268483, Forecast: 0.883548, Error: 0.615065
Using AR(6) for forecasting
Step 542: Synthetic history length 101, Actual: 0.266166, Forecast: 0.834564, Error: 0.568398
Using AR(7) for forecasting
Step 543: Synthetic history length 101, Actual: 0.263827, Forecast: 0.773797, Error: 0.509970
Using AR(6) for forecasting
Step 544: Synthetic history length 101, Actual: 0.261455, Forecast: 0.701806, Error: 0.440351
Using AR(7) for forecasting
Step 545: Synthetic history length 101, Actual: 0.259039, Forecast: 0.619334, Error: 0.360295
Using AR(6) for forecasting
Step 546: Synthetic history length 101, Actual: 0.256569, Forecast: 0.527307, Error: 0.270739
Using AR(6) for forecasting
Step 547: Synthetic history length 101, Actual: 0.254032, Forecast: 0.426822, Error: 0.172789
Using AR(6) for forecasting
Step 548: Synthetic history length 101, Actual: 0.251420, Forecast: 0.319136, Error: 0.067715
Using AR(6) for forecasting
Step 549: Synthetic history length 101, Actual: 0.248726, Forecast: 0.205654, Error: 0.043071
Using AR(6) for forecasting
Step 550: Synthetic history length 101, Actual: 0.245944, Forecast: 0.087915, Error: 0.158029
Using AR(6) for forecasting
Step 551: Synthetic history length 101, Actual: 0.243075, Forecast: -0.032433, Error: 0.275508
Using AR(6) for forecasting
Step 552: Synthetic history length 101, Actual: 0.240116, Forecast: -0.153650, Error: 0.393767
Using AR(6) for forecasting
Step 553: Synthetic history length 101, Actual: 0.237071, Forecast: -0.273929, Error: 0.511001
Using AR(6) for forecasting
Step 554: Synthetic history length 101, Actual: 0.233945, Forecast: -0.391419, Error: 0.625364
Using AR(6) for forecasting
Step 555: Synthetic history length 101, Actual: 0.230745, Forecast: -0.504252, Error: 0.734997
Using AR(7) for forecasting
Step 556: Synthetic history length 101, Actual: 0.227482, Forecast: -0.610573, Error: 0.838055
Using AR(7) for forecasting
Step 557: Synthetic history length 101, Actual: 0.224166, Forecast: -0.708566, Error: 0.932732
Using AR(7) for forecasting
Step 558: Synthetic history length 101, Actual: 0.220809, Forecast: -0.796481, Error: 1.017290
Using AR(7) for forecasting
Step 559: Synthetic history length 101, Actual: 0.217422, Forecast: -0.872667, Error: 1.090089
Using AR(6) for forecasting
Step 560: Synthetic history length 101, Actual: 0.214017, Forecast: -0.935594, Error: 1.149611
Using AR(7) for forecasting
Step 561: Synthetic history length 101, Actual: 0.210605, Forecast: -0.983885, Error: 1.194490
Using AR(6) for forecasting
Step 562: Synthetic history length 101, Actual: 0.207198, Forecast: -1.016338, Error: 1.223536
Using AR(7) for forecasting
Step 563: Synthetic history length 101, Actual: 0.203806, Forecast: -1.031953, Error: 1.235759
Using AR(7) for forecasting
Step 564: Synthetic history length 101, Actual: 0.200442, Forecast: -1.029948, Error: 1.230390
Using AR(6) for forecasting
Step 565: Synthetic history length 101, Actual: 0.197117, Forecast: -1.009784, Error: 1.206900
Using AR(6) for forecasting
Step 566: Synthetic history length 101, Actual: 0.193842, Forecast: -0.971175, Error: 1.165017
Using AR(7) for forecasting
Step 567: Synthetic history length 101, Actual: 0.190628, Forecast: -0.914106, Error: 1.104734
Using AR(6) for forecasting
Step 568: Synthetic history length 101, Actual: 0.187484, Forecast: -0.838837, Error: 1.026321
Using AR(7) for forecasting
Step 569: Synthetic history length 101, Actual: 0.184416, Forecast: -0.745909, Error: 0.930326
Using AR(6) for forecasting
Step 570: Synthetic history length 101, Actual: 0.181433, Forecast: -0.636147, Error: 0.817580
Using AR(6) for forecasting
Step 571: Synthetic history length 101, Actual: 0.178537, Forecast: -0.510654, Error: 0.689191
Using AR(6) for forecasting
Step 572: Synthetic history length 101, Actual: 0.175734, Forecast: -0.370805, Error: 0.546538
Using AR(7) for forecasting
Step 573: Synthetic history length 101, Actual: 0.173025, Forecast: -0.218232, Error: 0.391257
Using AR(7) for forecasting
Step 574: Synthetic history length 101, Actual: 0.170412, Forecast: -0.054814, Error: 0.225225
Using AR(7) for forecasting
Step 575: Synthetic history length 101, Actual: 0.167895, Forecast: 0.117352, Error: 0.050543
Using AR(7) for forecasting
Step 576: Synthetic history length 101, Actual: 0.165476, Forecast: 0.295968, Error: 0.130491
Using AR(6) for forecasting
Step 577: Synthetic history length 101, Actual: 0.163154, Forecast: 0.478566, Error: 0.315412
Using AR(7) for forecasting
Step 578: Synthetic history length 101, Actual: 0.160931, Forecast: 0.662543, Error: 0.501613
Using AR(8) for forecasting
Step 579: Synthetic history length 101, Actual: 0.158805, Forecast: 0.845190, Error: 0.686385
Using AR(7) for forecasting
Step 580: Synthetic history length 101, Actual: 0.156779, Forecast: 1.023731, Error: 0.866952
Using AR(7) for forecasting
Step 581: Synthetic history length 101, Actual: 0.154852, Forecast: 1.195366, Error: 1.040514
Using AR(7) for forecasting
Step 582: Synthetic history length 101, Actual: 0.153026, Forecast: 1.357309, Error: 1.204283
Using AR(7) for forecasting
Step 583: Synthetic history length 101, Actual: 0.151300, Forecast: 1.506828, Error: 1.355528
Using AR(7) for forecasting
Step 584: Synthetic history length 101, Actual: 0.149673, Forecast: 1.641295, Error: 1.491621
Using AR(7) for forecasting
Step 585: Synthetic history length 101, Actual: 0.148142, Forecast: 1.758220, Error: 1.610078
Using AR(7) for forecasting
Step 586: Synthetic history length 101, Actual: 0.146700, Forecast: 1.855301, Error: 1.708601
Using AR(7) for forecasting
Step 587: Synthetic history length 101, Actual: 0.145338, Forecast: 1.930458, Error: 1.785120
Using AR(6) for forecasting
Step 588: Synthetic history length 101, Actual: 0.144042, Forecast: 1.981874, Error: 1.837832
Using AR(7) for forecasting
Step 589: Synthetic history length 101, Actual: 0.142795, Forecast: 2.008030, Error: 1.865235
Using AR(7) for forecasting
Step 590: Synthetic history length 101, Actual: 0.141575, Forecast: 2.007738, Error: 1.866163
Using AR(6) for forecasting
Step 591: Synthetic history length 101, Actual: 0.140357, Forecast: 1.980170, Error: 1.839814
Using AR(6) for forecasting
Step 592: Synthetic history length 101, Actual: 0.139108, Forecast: 1.924878, Error: 1.785770
Using AR(7) for forecasting
Step 593: Synthetic history length 101, Actual: 0.137798, Forecast: 1.841818, Error: 1.704020
Using AR(8) for forecasting
Step 594: Synthetic history length 101, Actual: 0.136384, Forecast: 1.731358, Error: 1.594975
Using AR(7) for forecasting
Step 595: Synthetic history length 101, Actual: 0.134811, Forecast: 1.594291, Error: 1.459481
Using AR(6) for forecasting
Step 596: Synthetic history length 101, Actual: 0.133039, Forecast: 1.431833, Error: 1.298793
Using AR(6) for forecasting
Step 597: Synthetic history length 101, Actual: 0.131078, Forecast: 1.245616, Error: 1.114538
Using AR(7) for forecasting
Step 598: Synthetic history length 101, Actual: 0.128932, Forecast: 1.037685, Error: 0.908753
Using AR(6) for forecasting
Step 599: Synthetic history length 101, Actual: 0.126593, Forecast: 0.810472, Error: 0.683878
Using AR(6) for forecasting
Step 600: Synthetic history length 101, Actual: 0.124047, Forecast: 0.566774, Error: 0.442726
Using AR(6) for forecasting
Step 601: Synthetic history length 101, Actual: 0.121270, Forecast: 0.309725, Error: 0.188455
Using AR(6) for forecasting
Step 602: Synthetic history length 101, Actual: 0.118291, Forecast: 0.042757, Error: 0.075534
Using AR(6) for forecasting
Step 603: Synthetic history length 101, Actual: 0.114789, Forecast: -0.230439, Error: 0.345228
Using AR(8) for forecasting
Step 604: Synthetic history length 101, Actual: 0.110032, Forecast: -0.505964, Error: 0.615996
Using AR(7) for forecasting
Step 605: Synthetic history length 101, Actual: 0.104424, Forecast: -0.779761, Error: 0.884185
Using AR(6) for forecasting
Step 606: Synthetic history length 101, Actual: 0.098885, Forecast: -1.047670, Error: 1.146555
Using AR(6) for forecasting
Step 607: Synthetic history length 101, Actual: 0.093500, Forecast: -1.305489, Error: 1.398990
Using AR(7) for forecasting
Step 608: Synthetic history length 101, Actual: 0.088031, Forecast: -1.549035, Error: 1.637066
Using AR(6) for forecasting
Step 609: Synthetic history length 101, Actual: 0.082559, Forecast: -1.774206, Error: 1.856765
Using AR(7) for forecasting
Step 610: Synthetic history length 101, Actual: 0.076387, Forecast: -1.977047, Error: 2.053435
Using AR(8) for forecasting
Step 611: Synthetic history length 101, Actual: 0.068928, Forecast: -2.153814, Error: 2.222742
Using AR(6) for forecasting
Step 612: Synthetic history length 101, Actual: 0.060870, Forecast: -2.301033, Error: 2.361903
Using AR(7) for forecasting
Step 613: Synthetic history length 101, Actual: 0.052516, Forecast: -2.415568, Error: 2.468085
Using AR(6) for forecasting
Step 614: Synthetic history length 101, Actual: 0.043757, Forecast: -2.494671, Error: 2.538429
Using AR(6) for forecasting
Step 615: Synthetic history length 101, Actual: 0.034789, Forecast: -2.536042, Error: 2.570831
Using AR(6) for forecasting
Step 616: Synthetic history length 101, Actual: 0.025683, Forecast: -2.537871, Error: 2.563554
Using AR(6) for forecasting
Step 617: Synthetic history length 101, Actual: 0.016385, Forecast: -2.498888, Error: 2.515273
Using AR(9) for forecasting
Step 618: Synthetic history length 101, Actual: 0.006706, Forecast: -2.418393, Error: 2.425099
Using AR(7) for forecasting
Step 619: Synthetic history length 101, Actual: -0.003446, Forecast: -2.296287, Error: 2.292841
Using AR(6) for forecasting
Step 620: Synthetic history length 101, Actual: -0.014006, Forecast: -2.133094, Error: 2.119088
Using AR(7) for forecasting
Step 621: Synthetic history length 101, Actual: -0.024896, Forecast: -1.929971, Error: 1.905075
Using AR(6) for forecasting
Step 622: Synthetic history length 101, Actual: -0.036090, Forecast: -1.688710, Error: 1.652619
Using AR(7) for forecasting
Step 623: Synthetic history length 101, Actual: -0.047583, Forecast: -1.411732, Error: 1.364149
Using AR(7) for forecasting
Step 624: Synthetic history length 101, Actual: -0.059368, Forecast: -1.102073, Error: 1.042705
Using AR(6) for forecasting
Step 625: Synthetic history length 101, Actual: -0.071438, Forecast: -0.763353, Error: 0.691914

Walk-Forward ARIMA Statsmodels Forecasting Results:
==================================================
Total forecasts made: 596
Successful ARIMA forecasts: 596
Fallback to naive forecasts: 0
Mean Absolute Error (MAE): 0.363563
Root Mean Square Error (RMSE): 0.570082

Results saved to: arima_statsmodels_walk_forward_results.csv

First 10 forecasting steps:
 step   actual  forecast  absolute_error
   30 0.142711  0.142711    1.018209e-08
   31 0.143196  0.143196    3.544144e-08
   32 0.143662  0.143662    1.103325e-07
   33 0.144109  0.144109    2.509929e-07
   34 0.144539  0.144539    4.959751e-07
   35 0.144951  0.144952    8.679052e-07
   36 0.145346  0.145348    1.378588e-06
   37 0.145725  0.145727    2.031219e-06
   38 0.146087  0.146090    2.786959e-06
   39 0.146434  0.146438    3.587700e-06

Last 10 forecasting steps:
 step    actual  forecast  absolute_error
  616  0.025683 -2.537871        2.563554
  617  0.016385 -2.498888        2.515273
  618  0.006706 -2.418393        2.425099
  619 -0.003446 -2.296287        2.292841
  620 -0.014006 -2.133094        2.119088
  621 -0.024896 -1.929971        1.905075
  622 -0.036090 -1.688710        1.652619
  623 -0.047583 -1.411732        1.364149
  624 -0.059368 -1.102073        1.042705
  625 -0.071438 -0.763353        0.691914

Comparison with Naive Forecasting:
ARIMA Statsmodels MAE: 0.363563
Naive MAE: 0.001510
Degradation: 23984.55%
